{
  "schema_version": "td613-fv2",
  "analysis_mode": "canonical",
  "feature_vector_name": "F_v2",
  "feature_vector": {
    "char_entropy": 4.12,
    "word_entropy": 6.18,
    "bigram_entropy": 7.04,
    "type_token_ratio": 0.71,
    "avg_sentence_len": 17.6,
    "sentence_len_std": 6.2,
    "punct_density": 0.041,
    "avg_word_len": 4.87,
    "noun_fraction": 0.22,
    "contraction_density": 0.034,
    "comma_density": 0.019,
    "dash_density": 0.003
  },
  "phase_vector": [
    0.34,
    0.28,
    0.11,
    0.27
  ],
  "environment": {
    "custodial_integrity": 0.68,
    "custodial_drift": 0.41,
    "collapse_threshold": 0.2
  }
}